index,price,due_days,title,description,author,posted_time,link
60,$20.07,due in 13 days,"Enhance Excel Formula Generation App with Authentication, Signing, and Pricing Features with NodeJS","We are looking for a developer to enhance an existing Excel formula generation app with the following features:

Authentication: Allow users to log in to the app using their Replit or Google accounts.
Signing: Allow users to sign in to the app using their accounts.
Pricing: Implement a paywall for advanced formula generation tasks, with the option to purchase credits to use the app.In addition to these features, we would like to train the app to generate formulas for more complex prompts, using the best available OpenAI model. My previous devwloper has left enough room to competw this work.

Acceptance Criteria
To qualify for this bounty, you should have experience working with the OpenAI API and implementing authentication and pricing features in web applications.",Sarfrazkhan18,5 hours ago,https://replit.com/bounties/@Sarfrazkhan18/enhance-excel-formul?t=
61,$1.80,due in 3 days,Data Entry in Form,"I need someone to take some data from websites I will provide and enter it into a form, for a language learning app.

No need to know the language or any coding experience, I just need a large amount of words around 400-500 words copy pasted",CoderGautamYT,2 hours ago,https://replit.com/bounties/@CoderGautamYT/data-entry-in-form?t=
62,$4.50,due in 13 days,telegram marketing  auto add member to group. atuo send msg,"Describe the problem you are trying to solve here.
here is my code :https://replit.com/@carterwu768210/addmember-telegram#main.py
hi , i add telegtam sessions to login accounts
then i wanna use each account to add members from source group to target group.
problem is when i use server IP loop logining too many times . i got error
""2023-01-06 13:57:36.182 INFO mtprotosender - _disconnect: Disconnection from 149.154.175.53:443/TcpFull complete!""
it means that ,telegram doesn't accept loop login and auto logout all my sessions

Acceptance Criteria
Be specific about what you want in the solution here.
i wanna someone to help me to slove this problems ,maybe with porxy.
i have saw other people who is able to add 2000 members in one group easy , so there must be a solution
the add member function is at main.py
init .py  i dont use . because i bought all accounts they offer sessions already.
get_members.py  it help to creat the json in data .so that  main.py can read the j...",carterwu768210,16 minutes ago,https://replit.com/bounties/@carterwu768210/telegram-marketing-a?t=
63,$8.00,due in 1 month,Making A Game Site Template,"I Need A Site Template For Games That Makes It Easier For People To Work On With Minimal To No Coding Experience. I Also Want It To Be Customed. (Like If Someone Forks It And Changes It, It Still Says Like Part Of So And So)
Acceptance Criteria
Skilled IN CSS, HTML and Other Languages.
Technical Details
To Be Discussed
Timelines / Milestones
No Timeline But Trying To Get Done As Soon As Possible",UkeBoi,1 hour ago,https://replit.com/bounties/@UkeBoi/making-a-game-site-t?t=
64,$45.00,due in 6 days,Use Slack API to add Titles to everyone in workspace,"I have a Slack workspace with 300+ people, but not everyone has included their Title and Company which is less useful for the community. I want to use the Slack API to fill out this info for them. I'd like to be able to give you a CSV with everyone's info and then have this info get added to our Slack workspace.

Acceptance Criteria
A script that successfully takes a CSV and adds this information to the appropriate fields on each person's profile in a Slack workspace.

Technical Details
Will need to use the Slack API

Link to Project",DaysiGomez,26 minutes ago,https://replit.com/bounties/@DaysiGomez/use-slack-api-to-add?t=
65,$67.50,due in 1 month,MVP web app for students to submit screen/webcam recordings of flashcard reviews,"We'd like to create a basic web app that allows teachers to create sets of 2-sided digital ""flashcards"" and assign them to students; and then allows students to submit a combination screen recording/webcam recording of themselves reviewing the flashcards. The recording should show both what the student is seeing on the screen as the student navigates through the cards (click on a card to show the other side; then click a button to see the next card); and also the student's webcam view as he/she states the answers to questions out loud.

Acceptance Criteria
Account creation for teachers (who can create flashcards)
Account creation for students (who can view flashcards)
Ability of teachers to assign a set of flashcards to a student
Ability of students to see the assignment
Ability of students to record a flashcard review and submit it to teacher
Notification for teachers when an assignment is submitted
Whatever infrastructure is needed to support video storage

For th...",MichaelRegnier,10 minutes ago,https://replit.com/bounties/@MichaelRegnier/mvp-web-app-for-stud?t=
